{
  "_fixture": true,
  "schema": "fleetflight/check-report@1",
  "run_id": "fixture-v031",
  "created_at": "2026-09-26T00:00:00Z",
  "model": {
    "name": "core-ref",
    "version": "0.0-fixture",
    "hash": "sha256:d518669da72b"
  },
  "sut": {
    "id": "firmware-ref@v0.3.1",
    "name": "firmware-ref",
    "version": "v0.3.1"
  },
  "bounds": {
    "max_depth": 60,
    "max_injections": 3,
    "horizon_ms": 3000
  },
  "strategy": "bfs",
  "assumptions": [
    "ASSUMED bus latency <= 800 ms; messages may be delayed, dropped, duplicated or reordered",
    "ASSUMED BMS FAULT message is edge-triggered; status heartbeat every 2000 ms",
    "ASSUMED inverter holds last setpoint 1000 ms without a hub command, then IDLE",
    "ASSUMED hub boot takes 400 ms and clears its RX buffer",
    "ASSUMED shutdown budget 500 ms",
    "OUT OF SCOPE hardware interlocks (contactors, hardwired BMS trip)"
  ],
  "stats": {
    "states": 11903,
    "transitions": 35709,
    "max_depth_reached": 17,
    "wall_s": 1.5,
    "states_per_s": 7935.3,
    "new_states_per_depth": [
      1,
      6,
      21,
      55,
      120,
      240,
      410,
      690,
      980,
      1210,
      1400,
      1380,
      1250,
      1090,
      940,
      800,
      700,
      610
    ],
    "complete": true
  },
  "invariants": [
    {
      "id": "I1",
      "name": "FAULT_SHUTDOWN_BOUNDED",
      "description": "If the BMS is FAULTED, the inverter stops discharging within 500 ms.",
      "formula": "G( bms=FAULTED ∧ inv=DISCHARGING → (t − i1_since_ms) ≤ 500 )",
      "bound_ms": 500,
      "timer_key": "i1_since_ms",
      "result": "FAIL",
      "counterexample": "cex-0017",
      "violated_at_ms": 650,
      "violation_duration_ms": 550,
      "depth": 16,
      "worst_case_ms": null
    },
    {
      "id": "I2",
      "name": "NO_HIGH_POWER_WHEN_UNKNOWN",
      "description": "While BMS state is UNKNOWN the inverter never runs above 1 kW.",
      "formula": "G( bms=UNKNOWN → inv_watts ≤ 1000 )",
      "bound_ms": null,
      "timer_key": null,
      "result": "PASS",
      "counterexample": null,
      "violated_at_ms": null,
      "violation_duration_ms": null,
      "depth": null,
      "worst_case_ms": null
    },
    {
      "id": "I3",
      "name": "NO_RESURRECTED_COMMANDS",
      "description": "The inverter never executes a command after its expiry.",
      "formula": "G( inv_cmd ≠ ∅ → inv_cmd.expires_ms > t )",
      "bound_ms": null,
      "timer_key": null,
      "result": "PASS",
      "counterexample": null,
      "violated_at_ms": null,
      "violation_duration_ms": null,
      "depth": null,
      "worst_case_ms": null
    },
    {
      "id": "I4",
      "name": "IDEMPOTENT_COMMANDS",
      "description": "A duplicated command sequence number never causes a second physical action.",
      "formula": "G( applied_count(seq) ≤ 1 )",
      "bound_ms": null,
      "timer_key": null,
      "result": "PASS",
      "counterexample": null,
      "violated_at_ms": null,
      "violation_duration_ms": null,
      "depth": null,
      "worst_case_ms": null
    },
    {
      "id": "I5",
      "name": "COMMS_LOSS_SAFE_FALLBACK",
      "description": "After losing hub commands the inverter reaches IDLE or SHUTDOWN within 1.5 s.",
      "formula": "G( no_hub_cmd → (t − i5_since_ms) ≤ 1500 )",
      "bound_ms": 1500,
      "timer_key": "i5_since_ms",
      "result": "PASS",
      "counterexample": null,
      "violated_at_ms": null,
      "violation_duration_ms": null,
      "depth": null,
      "worst_case_ms": 900
    }
  ],
  "counterexample_files": [
    "cex-0017.json"
  ],
  "notes": [
    "FIXTURE: every number in this file is a placeholder."
  ],
  "verdict": "FAIL"
}
