{"schema":"fleetflight/check-report@1","run_id":"20260927T144314-v0.3.3-1a878b","created_at":"2026-09-27T14:43:14Z","model":{"name":"core-ref","version":"1.0","hash":"sha256:d16135e4c764"},"sut":{"id":"firmware-ref@v0.3.3","name":"firmware-ref","version":"v0.3.3"},"bounds":{"max_depth":120,"max_injections":3,"horizon_ms":4000},"strategy":"bfs","assumptions":["ASSUMED bus latency <= 800 ms; messages may be delayed, dropped, duplicated or reordered","ASSUMED BMS FAULT message is edge-triggered and retransmitted every 100 ms until the hub ACKs it; status heartbeat every 2000 ms","ASSUMED hub boot takes 400 ms and clears its RX buffer; only NVM survives a restart","ASSUMED shutdown budget 500 ms (a real number would come from Base's safety requirements)","ASSUMED one dispatch at t=0: DISCHARGE 5000 W, expires at 3000 ms; cloud re-dispatch after a hub restart is not modeled","ASSUMED network_loss means the hub-inverter link is down for the rest of the run","OUT OF SCOPE hardware interlocks (contactors, hardwired BMS trip)","OUT OF SCOPE core-ref is a reference model we wrote, not Base Gen 3 firmware"],"stats":{"states":1187853,"transitions":1728511,"max_depth_reached":83,"wall_s":35.5405,"states_per_s":33422.5,"new_states_per_depth":[1,4,16,82,308,986,1523,2880,2954,4808,4477,6816,6267,9198,7703,10986,9037,12601,10302,13998,10728,14425,11071,14780,11384,15108,11624,15317,11823,15514,12018,15709,12213,15904,12406,16096,12598,16288,12790,16480,12982,16678,13535,24612,17905,22358,17381,21761,16713,21038,16712,21014,16285,20519,16434,20640,16608,20767,16190,20239,16303,20323,16462,20206,16244,20157,16083,19884,16017,19814,16102,20010,16443,20379,16787,20753,17075,21027,17141,21073,17343,21258,17165,14210],"complete":true},"invariants":[{"id":"I1","name":"FAULT_SHUTDOWN_BOUNDED","description":"If the BMS is FAULTED, the inverter stops discharging within 500 ms.","formula":"G( bms=FAULTED ∧ inv=DISCHARGING → (t − i1_since_ms) < 500 )","bound_ms":500,"timer_key":"i1_since_ms","result":"PASS","counterexample":null,"violated_at_ms":null,"violation_duration_ms":null,"depth":null,"worst_case_ms":450},{"id":"I2","name":"NO_HIGH_POWER_WHEN_UNKNOWN","description":"The inverter never runs above 1000 W on a command the hub sent while it had no BMS report since its last boot (BMS state UNKNOWN to the hub).","formula":"G( inv_watts > 1000 → inv_basis ≠ UNKNOWN )","bound_ms":null,"timer_key":null,"result":"PASS","counterexample":null,"violated_at_ms":null,"violation_duration_ms":null,"depth":null,"worst_case_ms":null},{"id":"I3","name":"NO_RESURRECTED_COMMANDS","description":"The inverter never executes a command after its expiry.","formula":"G( inv=DISCHARGING → inv_cmd.expires_ms > t )","bound_ms":null,"timer_key":null,"result":"PASS","counterexample":null,"violated_at_ms":null,"violation_duration_ms":null,"depth":null,"worst_case_ms":null},{"id":"I4","name":"IDEMPOTENT_COMMANDS","description":"A command (epoch, seq) is applied by the inverter at most once: duplicated or reordered copies never cause a second physical action.","formula":"G( ∀(epoch,seq): applied_count(epoch,seq) ≤ 1 )","bound_ms":null,"timer_key":null,"result":"PASS","counterexample":null,"violated_at_ms":null,"violation_duration_ms":null,"depth":null,"worst_case_ms":null},{"id":"I5","name":"COMMS_LOSS_SAFE_FALLBACK","description":"If hub messages stop reaching the inverter, it leaves DISCHARGING within 1500 ms of the last one.","formula":"G( inv=DISCHARGING ∧ silent(hub→inv) → (t − i5_since_ms) < 1500 )","bound_ms":1500,"timer_key":"i5_since_ms","result":"PASS","counterexample":null,"violated_at_ms":null,"violation_duration_ms":null,"depth":null,"worst_case_ms":250}],"counterexample_files":[],"verdict":"PASS"}